{"wo_id":"WO-RUST-MCP-LIVE-PREVIEW-01","revision":1,"base_sha":"19234a036ed6a8d40c2ccdaec9b8186806d70eca","head_sha":"19234a036ed6a8d40c2ccdaec9b8186806d70eca","session_id":"codex-root-mcp-live-preview-2026-10-15","model":"gpt-6-luna","cli_version":"0.162.1","duration_s":0,"usage":{"input_tokens":null,"output_tokens":null},"ts":"2026-10-15T16:03:01Z","event":"run_started","run_id":"WO-RUST-MCP-LIVE-PREVIEW-01-parallel-started","status":"running","artifacts":["work/WO-RUST-MCP-LIVE-PREVIEW-01.md"],"note":"Three disjoint Luna lanes: protocol profile, app host/canvas integration, and preview usage guide. Root owns shared integration and manifests."}
