{
  "ts": "2026-10-13T20:17:43Z",
  "wo_id": "WO-MCP-TRANSPORT-01",
  "event": "ready",
  "revision": 2,
  "base_sha": "19234a036ed6a8d40c2ccdaec9b8186806d70eca",
  "head_sha": "19234a036ed6a8d40c2ccdaec9b8186806d70eca",
  "run_id": "mcp-transport-01-r2-ready-2026-10-13",
  "session_id": "codex-mcp-transport-01-r2-scope-correction-2026-10-13",
  "model": "gpt-6.1-sol",
  "cli_version": "codex 0.162.1",
  "duration_s": 0,
  "usage": {"input_tokens": null, "output_tokens": null},
  "status": "ready",
  "artifacts": ["work/WO-MCP-TRANSPORT-01.md", "artifacts/WO-MCP-TRANSPORT-01/scope-freeze-r2.txt"],
  "note": "Revision 2 READY for scope correction only: add required product inventory path. Remaining intent, limits, implementation, acceptance, protected paths, and verification are unchanged. No product implementation or tests ran during this correction."
}
