{
  "ts": "2026-10-14T06:03:04Z",
  "wo_id": "WO-RUST-GEOMETRY-01",
  "event": "accepted",
  "revision": 1,
  "base_sha": "19234a036ed6a8d40c2ccdaec9b8186806d70eca",
  "head_sha": "19234a036ed6a8d40c2ccdaec9b8186806d70eca",
  "run_id": "WO-RUST-GEOMETRY-01-accepted",
  "session_id": "rust-foundation-parallel-2026-10-14",
  "model": "gpt-6-luna",
  "cli_version": "0.162.1",
  "duration_s": 0,
  "usage": {
    "input_tokens": 280898,
    "output_tokens": 6568
  },
  "status": "accepted",
  "artifacts": [
    "artifacts/WO-RUST-GEOMETRY-01/verification-integrated.txt",
    "artifacts/WO-RUST-GEOMETRY-01/integration-audit.txt",
    "artifacts/WO-RUST-GEOMETRY-01/review.md",
    "artifacts/WO-RUST-GEOMETRY-01/parity-map.json"
  ],
  "note": "Scoped std-only Rust foundation accepted after independent LunaMedium review, exact isolated/root source audit and main package check/tests. Original C/tests/source/manifest/index preserved. Only named geometry or tile module parity, no full app/render claim."
}
