{"ts": "2026-10-13T20:55:27Z", "wo_id": "WO-DELIVERY-PARALLEL-01", "event": "run_started", "revision": 1, "base_sha": "19234a036ed6a8d40c2ccdaec9b8186806d70eca", "head_sha": "19234a036ed6a8d40c2ccdaec9b8186806d70eca", "run_id": "WO-DELIVERY-PARALLEL-01-r1-luna-run_started-2026-10-13T20:55:27Z", "session_id": "delivery-luna-resume", "model": "gpt-6-luna", "cli_version": "agent-runtime", "duration_s": 0, "usage": {"input_tokens": null, "output_tokens": null}, "status": "running", "artifacts": ["work/WO-DELIVERY-PARALLEL-01.md", "artifacts/WO-DELIVERY-PARALLEL-01/scope-freeze-r1.txt"], "note": "Owner authorized existing-allowance Luna execution with scoped parallel worktrees, disjoint ownership, focused checks and serialized integration; broad UI/E2E remains final."}
