{"ts":"2026-10-13T06:51:20Z","wo_id":"WO-PRODUCT-GOAL-01","event":"run_started","revision":1,"base_sha":"19234a036ed6a8d40c2ccdaec9b8186806d70eca","head_sha":"19234a0","run_id":"product-goal-01-start-2026-10-13","session_id":"codex-product-goal-01-2026-10-13","model":"gpt-6.1-sol","cli_version":"codex","duration_s":0,"usage":{"input_tokens":null,"output_tokens":null},"status":"running","artifacts":[],"note":"Started product-goal documentation and repository roadmap alignment."}