{"ts":"2026-10-11T14:44:32Z","wo_id":"WO-CI-NIGHTLY-01","event":"ready","revision":1,"base_sha":"c43fa826c0fbc8910e8dc0c09b4139c8aa615995","head_sha":"c43fa826c0fbc8910e8dc0c09b4139c8aa615995","run_id":"ci-nightly-01-ready","session_id":"codex-ci-nightly-20261011","model":"gpt-6-luna","cli_version":"api-session","duration_s":0,"usage":{"input_tokens":null,"output_tokens":null},"status":"ready","artifacts":[],"note":"Frozen READY CI-only order for nightly sanitizer prerequisites; parallel-safe with base c43fa826. Implementation scoped to nightly workflow plus own evidence and state/ledger records."}
