{
  "ts": "2026-10-14T06:15:42Z",
  "wo_id": "WO-RUST-BASE-01",
  "event": "verified",
  "revision": 1,
  "base_sha": "19234a036ed6a8d40c2ccdaec9b8186806d70eca",
  "head_sha": "19234a036ed6a8d40c2ccdaec9b8186806d70eca",
  "run_id": "WO-RUST-BASE-01-verified",
  "session_id": "rust-foundation-parallel-2026-10-14",
  "model": "gpt-6-luna",
  "cli_version": "0.162.1",
  "duration_s": 0,
  "usage": {
    "input_tokens": 1811765,
    "output_tokens": 27227
  },
  "status": "pass",
  "artifacts": [
    "artifacts/WO-RUST-BASE-01/verification-integrated.txt",
    "artifacts/WO-RUST-BASE-01/integration-audit.txt",
    "artifacts/WO-RUST-BASE-01/review.md",
    "artifacts/WO-RUST-BASE-01/parity-map.json"
  ],
  "note": "Scoped std-only Rust base or JSON core accepted after independent LunaHigh review, exact source/conflict audit and main package check/tests. Original source/assertions/manifest/index preserved; API adaptations documented, nonblocking coverage gaps retained. No full app claim."
}
