{
  "ts": "2026-10-14T05:01:35Z",
  "wo_id": "WO-MCP-CAPTURE-01",
  "event": "ready",
  "revision": 1,
  "base_sha": "19234a036ed6a8d40c2ccdaec9b8186806d70eca",
  "head_sha": "19234a036ed6a8d40c2ccdaec9b8186806d70eca",
  "run_id": "WO-MCP-CAPTURE-01-ready",
  "session_id": "luna-parallel-2026-10-14",
  "model": "gpt-6-luna",
  "cli_version": "agent-runtime",
  "duration_s": 0,
  "usage": {
    "input_tokens": null,
    "output_tokens": null
  },
  "status": "ready",
  "artifacts": [
    "work/WO-MCP-CAPTURE-01.md"
  ],
  "note": "Two-stage owned prevalidated capture then strict worker finalize; default checksum validation preserved. Isolated Luna High, focused lifetime/check/probe evidence, no full UI/performance/async claim."
}
