{"ts":"2026-10-13T06:59:18Z","wo_id":"WO-PROJECT-01","event":"run_finished","revision":1,"base_sha":"19234a036ed6a8d40c2ccdaec9b8186806d70eca","head_sha":"19234a0","run_id":"project-01-focused-complete-2026-10-13","session_id":"codex-project-01-2026-10-13","model":"gpt-6.1-sol","cli_version":"codex","duration_s":0,"usage":{"input_tokens":null,"output_tokens":null},"status":"pass","artifacts":["artifacts/WO-PROJECT-01/verification.txt"],"note":"V1 bounded project codec implemented; focused Debug and ASan/UBSan CTest pass. UI/E2E suite deferred; editor file integration and independent review remain future work."}