{"ts":"2026-10-09T01:24:33Z","wo_id":"WO-M2-05","revision":1,"base_sha":"d45060bb7211a67dd62b83c156f0a9775a85c55a","head_sha":"323a55c181307b8ab0bc4f3989a14ce156abafa7","run_id":"m205-ready-20261009","session_id":"project-owner-frozen-order","model":"gpt-6-luna","cli_version":"codex-cli 0.160.1","duration_s":0.0,"usage":{"input_tokens":null,"output_tokens":null},"event":"ready","status":"ready","artifacts":["work-order spec SHA-256 32e88b289096e7793adf851cad0e54d820fa8c7cf88e5b6389b2899af08b42a9"],"note":"Frozen WO-M2-05 revision 1 is ready at its declared base."}
