{
  "ts": "2026-10-14T04:49:56Z",
  "wo_id": "WO-MCP-GIF-WORKER-01",
  "event": "verified",
  "revision": 1,
  "base_sha": "19234a036ed6a8d40c2ccdaec9b8186806d70eca",
  "head_sha": "19234a036ed6a8d40c2ccdaec9b8186806d70eca",
  "run_id": "WO-MCP-GIF-WORKER-01-r1-verified",
  "session_id": "async-parallel-luna-2026-10-14",
  "model": "gpt-6-luna",
  "cli_version": "agent-runtime",
  "duration_s": 0,
  "usage": {
    "input_tokens": null,
    "output_tokens": null
  },
  "status": "pass",
  "artifacts": [
    "artifacts/WO-MCP-GIF-WORKER-01/verification-integrated.txt",
    "artifacts/WO-MCP-GIF-WORKER-01/integration-audit.txt",
    "artifacts/WO-MCP-GIF-WORKER-01/review-final-coordinator.txt"
  ],
  "note": "Snapshot-only native GIF worker accepted uncommitted after focused review/repair, queue-only cancellation, decoded frame/timing checks and exact integration audit. Main build and mcp-export-job1/1 pass. Integral FPS matches existing tool/encoder. Owner bridge still required."
}
