{"wo_id":"WO-RUST-MCP-LIVE-PREVIEW-01","revision":1,"base_sha":"19234a036ed6a8d40c2ccdaec9b8186806d70eca","head_sha":"19234a036ed6a8d40c2ccdaec9b8186806d70eca","session_id":"codex-root-mcp-live-preview-2026-10-15","model":"gpt-6-luna","cli_version":"0.162.1","duration_s":1500,"usage":{"input_tokens":null,"output_tokens":null},"event":"verified","ts":"2026-10-15T16:28:11Z","run_id":"WO-RUST-MCP-LIVE-PREVIEW-01-main-verified","status":"pass","artifacts":["artifacts/WO-RUST-MCP-LIVE-PREVIEW-01/reviewer-report.md","artifacts/WO-RUST-MCP-LIVE-PREVIEW-01/main-format.log"],"note":"Independent review closed required-attributes/schema-description findings; follow-up review found no blockers. Native runtime remains unverified."}
