{"ts": "2026-10-13T20:59:02Z", "wo_id": "WO-DELIVERY-PARALLEL-01", "event": "accepted", "revision": 1, "base_sha": "19234a036ed6a8d40c2ccdaec9b8186806d70eca", "head_sha": "19234a036ed6a8d40c2ccdaec9b8186806d70eca", "run_id": "parallel-plan-accepted-2026-10-13T20:59:02Z", "session_id": "delivery-luna-resume", "model": "gpt-6-luna", "cli_version": "agent-runtime", "duration_s": 0, "usage": {"input_tokens": null, "output_tokens": null}, "status": "accepted", "artifacts": ["docs/product/luna-parallel-delivery-plan.md", "artifacts/WO-DELIVERY-PARALLEL-01/verification.txt", "artifacts/WO-DELIVERY-PARALLEL-01/plan-review-luna.txt"], "note": "Full ADR-0018 gates retained, concrete frozen worker scopes linked, effort/usage and integration policy reviewed. Two isolated High implementation workers launched; source fingerprint preservation and metadata/diff checks pass. Plan acceptance only; goal and feature tasks active."}
